{
  "provenance": {
    "author_agent": "review-security-authz",
    "run_id": "015-resource-time-buffer-review-security-authz-r3-mulhg9k7",
    "story": "015-resource-time-buffer",
    "phase": "C5",
    "inputs": [
      { "path": "runs/015-resource-time-buffer/review/round-3/diff.patch", "sha256": "d477262bd13a4aafa8fb3db5691ff13c4973cffd57c0f8e0ee51890a4551c94b" },
      { "path": "runs/015-resource-time-buffer/review/round-3/scope.json", "sha256": "c3d93acc67d287ea3282722c5a1601d0d5ec3cbb0516a3915eb67b471787c5ae" },
      { "path": "runs/015-resource-time-buffer/story.md", "sha256": "9212e4b66dae0a890f38c3653c2c4a06771aa7d4c12c3c14a06da84604f56490" },
      { "path": "specs/015-resource-time-buffer/spec.md", "sha256": "dbdfe2408791cff4604b73dee20dba490b69a674be806a0ed09ff7cba9f21a66" },
      { "path": "runs/015-resource-time-buffer/contract-next.json", "sha256": "433a701276108c541bac93297e953a39cbd80181bfb17675616e2211325b5414" },
      { "path": "runs/015-resource-time-buffer/review/round-2/review-security-authz.findings.json", "sha256": "0f8933804ced8bc3b7a96d79ab341666d816049948261bad61f0903e3b673a83" }
    ],
    "schema_version": "1"
  },
  "reviewer": "review-security-authz",
  "round": 3,
  "scope": {
    "diff_sha": "1ce028a018dd5d9d0ba8796b44320ec5964b76af",
    "files": [
      "backend/src/Modules/Resources/ThingsBooksy.Modules.Resources.IntegrationTests/Clients/ResourcesResourcePropertyDefinitionFactory.cs",
      "backend/src/Modules/Resources/ThingsBooksy.Modules.Resources.IntegrationTests/Clients/ResourcesResourcePropertyValueFactory.cs",
      "backend/src/Modules/Resources/ThingsBooksy.Modules.Resources.IntegrationTests/ResourceTypes/SoftDeleteResourceTypeReadPathTests.cs",
      "backend/src/Modules/Resources/ThingsBooksy.Modules.Resources.IntegrationTests/Clients/ResourcesTestClient.cs",
      "runs/015-resource-time-buffer/review/round-2/review-security-authz.findings.json",
      "runs/015-resource-time-buffer/review/round-1/review-security-authz.findings.json"
    ]
  },
  "previous_findings_status": [
    { "id": "review-security-authz-1-1", "status": "STILL_OPEN" },
    { "id": "review-security-authz-1-2", "status": "STILL_OPEN" },
    { "id": "review-security-authz-1-3", "status": "STILL_OPEN" }
  ],
  "findings": [],
  "summary": { "blockers": 0, "majors": 0, "minors": 0, "opinions": 0 }
}
