{
  "provenance": {
    "author_agent": "review-security-authz",
    "run_id": "015-resource-time-buffer-review-security-authz-mulh5qy2",
    "story": "015-resource-time-buffer",
    "phase": "C5",
    "inputs": [
      { "path": "runs/015-resource-time-buffer/review/round-2/diff.patch", "sha256": "647c2ac8ad5217d237646a7c21dbabd790026f87e1ff254de6ce4883436ea293" },
      { "path": "runs/015-resource-time-buffer/review/round-2/scope.json", "sha256": "85769aba578c3dae6a354f13961f5195078b92a05f6c30f13cdfce0af01cdb02" },
      { "path": "runs/015-resource-time-buffer/story.md", "sha256": "9212e4b66dae0a890f38c3653c2c4a06771aa7d4c12c3c14a06da84604f56490" },
      { "path": "specs/015-resource-time-buffer/spec.md", "sha256": "dbdfe2408791cff4604b73dee20dba490b69a674be806a0ed09ff7cba9f21a66" },
      { "path": "runs/015-resource-time-buffer/contract-next.json", "sha256": "433a701276108c541bac93297e953a39cbd80181bfb17675616e2211325b5414" },
      { "path": "runs/015-resource-time-buffer/review/round-1/review-security-authz.findings.json", "sha256": "12112fe2600ca4b21ce0e4e2dc915bc710beace5089d0d75d6605c895607d781" }
    ],
    "schema_version": "1"
  },
  "reviewer": "review-security-authz",
  "round": 2,
  "scope": {
    "diff_sha": "b7244d457f9e50f2c670cbe47693b1dd5097ddb9",
    "files": [
      "backend/src/Modules/Resources/ThingsBooksy.Modules.Resources.IntegrationTests/ResourceTypes/SoftDeleteResourceTypeReadPathTests.cs",
      "backend/src/Modules/Resources/ThingsBooksy.Modules.Resources.Core/Features/GetResourceInstances/GetResourceInstancesQueryHandler.cs",
      "backend/src/Modules/Resources/ThingsBooksy.Modules.Resources.Core/Features/GetResourceInstances/DataProviders/GetResourceInstancesQueryDataProvider.cs",
      "backend/src/Modules/Resources/ThingsBooksy.Modules.Resources.Core/Events/Handlers/GroupDeletedHandler.cs",
      "backend/src/Modules/Resources/ThingsBooksy.Modules.Resources.Core/Features/DeleteResourceType/DeleteResourceTypeCommandHandler.cs",
      "backend/src/Modules/Resources/ThingsBooksy.Modules.Resources.Migrations/Migrations/20260928111659_SoftDeleteResourceTypeUniqueIndex.cs"
    ]
  },
  "previous_findings_status": [
    { "id": "review-security-authz-1-1", "status": "STILL_OPEN" },
    { "id": "review-security-authz-1-2", "status": "STILL_OPEN" },
    { "id": "review-security-authz-1-3", "status": "STILL_OPEN" }
  ],
  "findings": [],
  "summary": { "blockers": 0, "majors": 0, "minors": 0, "opinions": 0 }
}
